{
  "$schema": "https://json-schema.org/draft/2020-12/schema",
  "$id": "m29-effect-window.schema.json",
  "title": "M29 Effect window golden vector",
  "description": "Language-neutral parity cases for the Effect window. A Protocol source's DURING is its declared start/end (no end date = ongoing until now); a Compound source's DURING is the earliest to the latest logged Dose (exactly one Dose = ongoing until now, none = no window). BEFORE and AFTER mirror DURING's length on either side. Segments are half-open [start, end), so a boundary sample lands in exactly one. Each segment reports its sample count and mean (null when empty); the deltas are during - before, after - during, and after - before, null when either side is empty.",
  "type": "object",
  "additionalProperties": false,
  "required": ["name", "domain", "schemaVersion", "schema", "cases"],
  "properties": {
    "name": {"const": "m29-effect-window"},
    "domain": {"const": "effect-window"},
    "schemaVersion": {"const": 1},
    "schema": {"const": "m29-effect-window.schema.json"},
    "cases": {
      "type": "array",
      "minItems": 1,
      "items": {"$ref": "#/$defs/case"}
    }
  },
  "$defs": {
    "instant": {
      "type": "string",
      "pattern": "^\\d{4}-\\d{2}-\\d{2}T\\d{2}:\\d{2}:\\d{2}\\.\\d{3}Z$"
    },
    "source": {
      "oneOf": [
        {
          "type": "object",
          "additionalProperties": false,
          "required": ["kind", "startDate", "endDate"],
          "properties": {
            "kind": {"const": "protocol"},
            "startDate": {"$ref": "#/$defs/instant"},
            "endDate": {"oneOf": [{"$ref": "#/$defs/instant"}, {"type": "null"}]}
          }
        },
        {
          "type": "object",
          "additionalProperties": false,
          "required": ["kind", "doseTimes"],
          "properties": {
            "kind": {"const": "compound"},
            "doseTimes": {"type": "array", "items": {"$ref": "#/$defs/instant"}}
          }
        }
      ]
    },
    "sample": {
      "type": "object",
      "additionalProperties": false,
      "required": ["at", "value"],
      "properties": {
        "at": {"$ref": "#/$defs/instant"},
        "value": {"type": "number"}
      }
    },
    "window": {
      "type": "object",
      "additionalProperties": false,
      "required": ["duringStart", "duringEnd", "duringEndOrNow", "beforeStart", "afterEnd"],
      "properties": {
        "duringStart": {"$ref": "#/$defs/instant"},
        "duringEnd": {"oneOf": [{"$ref": "#/$defs/instant"}, {"type": "null"}]},
        "duringEndOrNow": {"$ref": "#/$defs/instant"},
        "beforeStart": {"$ref": "#/$defs/instant"},
        "afterEnd": {"$ref": "#/$defs/instant"}
      }
    },
    "segment": {
      "type": "object",
      "additionalProperties": false,
      "required": ["count", "mean"],
      "properties": {
        "count": {"type": "integer", "minimum": 0},
        "mean": {"type": ["number", "null"]}
      }
    },
    "nullableNumber": {"type": ["number", "null"]},
    "case": {
      "type": "object",
      "additionalProperties": false,
      "required": ["name", "input", "expected"],
      "properties": {
        "name": {"type": "string", "minLength": 1},
        "input": {
          "type": "object",
          "additionalProperties": false,
          "required": ["source", "now", "samples"],
          "properties": {
            "source": {"$ref": "#/$defs/source"},
            "now": {"$ref": "#/$defs/instant"},
            "samples": {"type": "array", "items": {"$ref": "#/$defs/sample"}}
          }
        },
        "expected": {
          "type": "object",
          "additionalProperties": false,
          "required": ["window", "segments", "deltas"],
          "properties": {
            "window": {"oneOf": [{"$ref": "#/$defs/window"}, {"type": "null"}]},
            "segments": {
              "type": "object",
              "additionalProperties": false,
              "required": ["before", "during", "after"],
              "properties": {
                "before": {"$ref": "#/$defs/segment"},
                "during": {"$ref": "#/$defs/segment"},
                "after": {"$ref": "#/$defs/segment"}
              }
            },
            "deltas": {
              "type": "object",
              "additionalProperties": false,
              "required": ["during", "after", "overall"],
              "properties": {
                "during": {"$ref": "#/$defs/nullableNumber"},
                "after": {"$ref": "#/$defs/nullableNumber"},
                "overall": {"$ref": "#/$defs/nullableNumber"}
              }
            }
          }
        }
      }
    }
  }
}
